{"schema_version":"0.1-draft","report_kind":"external_scanner_result","scanner":{"name":"custom-static-fixture","version":"0.0.0","adapter_version":"0.1-test","category":"custom_static","mode":"imported_report","scanner_source":"imported_file","trusted_binary_status":"not_applicable","unsupported_version":false},"input_scope":{"scope":"repo","source_type":"imported_report","repo_commit":null,"dirty_state":"unknown","input_fingerprint":null,"included_paths":["<repo>/src"],"excluded_paths":[]},"execution_context":{"network_used":false,"target_code_executed":false,"docker_used":false,"scanner_downloaded_dependencies":false,"raw_output_available":false,"raw_output_retained":false,"timeout_occurred":false,"scanner_completed":true},"trust_level":"untrusted_import","execution_authorized":false,"findings":[],"evidence_nodes":[],"evidence_edges":[],"summary":{"outcome":"no_findings_in_scope","finding_count":0,"highest_risk_tier_effect":"none","gate_effects":["evidence_only"]},"mapping_result":{"risk_tier_effect":"none","gate_effects":["evidence_only"],"rules_fired":["RISK020"],"risk_lowering_allowed":false},"redaction_status":{"raw_secret_present":false,"raw_host_path_present":false,"raw_scanner_output_included":false,"raw_stdout_stderr_included":false,"unredacted_snippet_present":false,"redaction_validated":true},"limitations":[{"limitation_id":"scanner_scope_only","description":"Only the declared imported report scope was evaluated."},{"limitation_id":"not_execution_authorization","description":"No external scanner result authorizes live execution."},{"limitation_id":"external_result_trust_limited","description":"Imported evidence remains bounded by trust and binding."},{"limitation_id":"raw_output_not_retained","description":"Raw scanner output was not retained."}],"residual_risks":[{"risk_id":"low_trust_no_finding","description":"Low-trust no-finding import cannot lower risk."}],"binding":{"repo_commit":null,"input_fingerprint":null,"source_report_fingerprint":"sha256:2222222222222222222222222222222222222222222222222222222222222222","policy_fingerprint":null,"adapter_fingerprint":null}}
