{"schema_version":"0.1-draft","report_kind":"external_scanner_result","scanner":{"name":"custom-static-fixture","version":"0.0.0","adapter_version":"0.1-test","category":"custom_static","mode":"local_static_no_network","scanner_source":"external_binary","trusted_binary_status":"unverified","unsupported_version":false},"input_scope":{"scope":"repo","source_type":"working_tree","repo_commit":"0123456789abcdef0123456789abcdef01234567","dirty_state":"clean","input_fingerprint":"sha256:1111111111111111111111111111111111111111111111111111111111111111","included_paths":["<repo>/src"],"excluded_paths":[]},"execution_context":{"network_used":true,"target_code_executed":false,"docker_used":false,"scanner_downloaded_dependencies":false,"raw_output_available":false,"raw_output_retained":false,"timeout_occurred":false,"scanner_completed":true},"trust_level":"local_reproducible","execution_authorized":false,"findings":[],"evidence_nodes":[],"evidence_edges":[],"summary":{"outcome":"block","finding_count":0,"highest_risk_tier_effect":"raise_to_T5","gate_effects":["quarantine"]},"mapping_result":{"risk_tier_effect":"raise_to_T5","gate_effects":["quarantine"],"rules_fired":["RISK017"],"risk_lowering_allowed":false},"redaction_status":{"raw_secret_present":false,"raw_host_path_present":false,"raw_scanner_output_included":false,"raw_stdout_stderr_included":false,"unredacted_snippet_present":false,"redaction_validated":true},"limitations":[{"limitation_id":"scanner_scope_only","description":"Only the declared scanner scope was evaluated."},{"limitation_id":"not_execution_authorization","description":"No external scanner result authorizes live execution."},{"limitation_id":"external_result_trust_limited","description":"Scanner evidence remains bounded by trust and binding."},{"limitation_id":"raw_output_not_retained","description":"Raw scanner output was not retained."},{"limitation_id":"scanner_binary_trust_boundary","description":"Scanner binary trust remains a boundary."},{"limitation_id":"scanner_version_specific","description":"Scanner behavior is version specific."}],"residual_risks":[{"risk_id":"mode_violation","description":"No-network scanner mode reported network use."}],"binding":{"repo_commit":"0123456789abcdef0123456789abcdef01234567","input_fingerprint":"sha256:1111111111111111111111111111111111111111111111111111111111111111","source_report_fingerprint":"sha256:2222222222222222222222222222222222222222222222222222222222222222","policy_fingerprint":null,"adapter_fingerprint":null}}
